,Review,Score,Source
0,Wow... Loved this place.,1,yelp
1,Crust is not good.,0,yelp
2,Not tasty and the texture was just nasty.,0,yelp
3,Stopped by during the late May bank holiday off Rick Steve recommendation and loved it.,1,yelp
4,The selection on the menu was great and so were the prices.,1,yelp
5,Now I am getting angry and I want my damn pho.,0,yelp
6,Honeslty it didn't taste THAT fresh.),0,yelp
7,The potatoes were like rubber and you could tell they had been made up ahead of time being kept under a warmer.,0,yelp
8,The fries were great too.,1,yelp
9,A great touch.,1,yelp
10,Service was very prompt.,1,yelp
11,Would not go back.,0,yelp
12,The cashier had no care what so ever on what I had to say it still ended up being wayyy overpriced.,0,yelp
13,"I tried the Cape Cod ravoli, chicken,with cranberry...mmmm!",1,yelp
14,I was disgusted because I was pretty sure that was human hair.,0,yelp
15,I was shocked because no signs indicate cash only.,0,yelp
16,Highly recommended.,1,yelp
17,Waitress was a little slow in service.,0,yelp
18,"This place is not worth your time, let alone Vegas.",0,yelp
19,did not like at all.,0,yelp
20,The Burrittos Blah!,0,yelp
21,"The food, amazing.",1,yelp
22,Service is also cute.,1,yelp
23,I could care less... The interior is just beautiful.,1,yelp
24,So they performed.,1,yelp
25,That's right....the red velvet cake.....ohhh this stuff is so good.,1,yelp
26,- They never brought a salad we asked for.,0,yelp
27,"This hole in the wall has great Mexican street tacos, and friendly staff.",1,yelp
28,"Took an hour to get our food only 4 tables in restaurant my food was Luke warm, Our sever was running around like he was totally overwhelmed.",0,yelp
29,The worst was the salmon sashimi.,0,yelp
30,"Also there are combos like a burger, fries, and beer for 23 which is a decent deal.",1,yelp
31,This was like the final blow!,0,yelp
32,I found this place by accident and I could not be happier.,1,yelp
33,"seems like a good quick place to grab a bite of some familiar pub food, but do yourself a favor and look elsewhere.",0,yelp
34,"Overall, I like this place a lot.",1,yelp
35,The only redeeming quality of the restaurant was that it was very inexpensive.,1,yelp
36,Ample portions and good prices.,1,yelp
37,"Poor service, the waiter made me feel like I was stupid every time he came to the table.",0,yelp
38,My first visit to Hiro was a delight!,1,yelp
39,Service sucks.,0,yelp
40,The shrimp tender and moist.,1,yelp
41,There is not a deal good enough that would drag me into that establishment again.,0,yelp
42,Hard to judge whether these sides were good because we were grossed out by the melted styrofoam and didn't want to eat it for fear of getting sick.,0,yelp
43,"On a positive note, our server was very attentive and provided great service.",1,yelp
44,"Frozen pucks of disgust, with some of the worst people behind the register.",0,yelp
45,The only thing I did like was the prime rib and dessert section.,1,yelp
46,It's too bad the food is so damn generic.,0,yelp
47,"The burger is good beef, cooked just right.",1,yelp
48,If you want a sandwich just go to any Firehouse!!!!!,1,yelp
49,"My side Greek salad with the Greek dressing was so tasty, and the pita and hummus was very refreshing.",1,yelp
50,We ordered the duck rare and it was pink and tender on the inside with a nice char on the outside.,1,yelp
51,He came running after us when he realized my husband had left his sunglasses on the table.,1,yelp
52,Their chow mein is so good!,1,yelp
53,"They have horrible attitudes towards customers, and talk down to each one when customers don't enjoy their food.",0,yelp
54,The portion was huge!,1,yelp
55,"Loved it...friendly servers, great food, wonderful and imaginative menu.",1,yelp
56,The Heart Attack Grill in downtown Vegas is an absolutely flat-lined excuse for a restaurant.,0,yelp
57,Not much seafood and like 5 strings of pasta at the bottom.,0,yelp
58,"The salad had just the right amount of sauce to not over power the scallop, which was perfectly cooked.",1,yelp
59,"The ripped banana was not only ripped, but petrified and tasteless.",0,yelp
60,At least think to refill my water before I struggle to wave you over for 10 minutes.,0,yelp
61,This place receives stars for their APPETIZERS!!!,1,yelp
62,The cocktails are all handmade and delicious.,1,yelp
63,We'd definitely go back here again.,1,yelp
64,We are so glad we found this place.,1,yelp
65,"Great food and service, huge portions and they give a military discount.",1,yelp
66,Always a great time at Dos Gringos!,1,yelp
67,Update.....went back for a second time and it was still just as amazing,1,yelp
68,We got the food and apparently they have never heard of salt and the batter on the fish was chewy.,0,yelp
69,A great way to finish a great.,1,yelp
70,"The deal included 5 tastings and 2 drinks, and Jeff went above and beyond what we expected.",1,yelp
71,"- Really, really good rice, all the time.",1,yelp
72,The service was meh.,0,yelp
73,"It took over 30 min to get their milkshake, which was nothing more than chocolate milk.",0,yelp
74,"I guess I should have known that this place would suck, because it is inside of the Excalibur, but I didn't use my common sense.",0,yelp
75,The scallop dish is quite appalling for value as well.,0,yelp
76,2 times - Very Bad Customer Service !,0,yelp
77,The sweet potato fries were very good and seasoned well.,1,yelp
78,Today is the second time I've been to their lunch buffet and it was pretty good.,1,yelp
79,There is so much good food in Vegas that I feel cheated for wasting an eating opportunity by going to Rice and Company.,0,yelp
80,Coming here is like experiencing an underwhelming relationship where both parties can't wait for the other person to ask to break up.,0,yelp
81,walked in and the place smelled like an old grease trap and only 2 others there eating.,0,yelp
82,The turkey and roast beef were bland.,0,yelp
83,This place has it!,1,yelp
84,The pan cakes everyone are raving about taste like a sugary disaster tailored to the palate of a six year old.,0,yelp
85,I love the Pho and the spring rolls oh so yummy you have to try.,1,yelp
86,The poor batter to meat ratio made the chicken tenders very unsatisfying.,0,yelp
87,All I have to say is the food was amazing!!!,1,yelp
88,Omelets are to die for!,1,yelp
89,Everything was fresh and delicious!,1,yelp
90,"In summary, this was a largely disappointing dining experience.",0,yelp
91,"It's like a really sexy party in your mouth, where you're outrageously flirting with the hottest person at the party.",1,yelp
92,"Never been to Hard Rock Casino before, WILL NEVER EVER STEP FORWARD IN IT AGAIN!",0,yelp
93,Best breakfast buffet!!!,1,yelp
94,say bye bye to your tip lady!,0,yelp
95,We'll never go again.,0,yelp
96,Will be back again!,1,yelp
97,Food arrived quickly!,1,yelp
98,It was not good.,0,yelp
99,"On the up side, their cafe serves really good food.",1,yelp
100,"Our server was fantastic and when he found out the wife loves roasted garlic and bone marrow, he added extra to our meal and another marrow to go!",1,yelp
101,"The only good thing was our waiter, he was very helpful and kept the bloddy mary's coming.",1,yelp
102,"Best Buffet in town, for the price you cannot beat it.",1,yelp
103,"I LOVED their mussels cooked in this wine reduction, the duck was tender, and their potato dishes were delicious.",1,yelp
104,This is one of the better buffets that I have been to.,1,yelp
105,So we went to Tigerlilly and had a fantastic afternoon!,1,yelp
106,"The food was delicious, our bartender was attentive and personable AND we got a great deal!",1,yelp
107,The ambience is wonderful and there is music playing.,1,yelp
108,Will go back next trip out.,1,yelp
109,Sooooo good!!,1,yelp
110,"REAL sushi lovers, let's be honest - Yama is not that good.",0,yelp
111,"At least 40min passed in between us ordering and the food arriving, and it wasn't that busy.",0,yelp
112,This is a really fantastic Thai restaurant which is definitely worth a visit.,1,yelp
113,"Nice, spicy and tender.",1,yelp
114,Good prices.,1,yelp
115,Check it out.,1,yelp
116,It was pretty gross!,0,yelp
117,I've had better atmosphere.,0,yelp
118,Kind of hard to mess up a steak but they did.,0,yelp
119,"Although I very much liked the look and sound of this place, the actual experience was a bit disappointing.",0,yelp
120,I just don't know how this place managed to served the blandest food I have ever eaten when they are preparing Indian cuisine.,0,yelp
121,"Worst service to boot, but that is the least of their worries.",0,yelp
122,Service was fine and the waitress was friendly.,1,yelp
123,"The guys all had steaks, and our steak loving son who has had steak at the best and worst places said it was the best steak he's ever eaten.",1,yelp
124,"We thought you'd have to venture further away to get good sushi, but this place really hit the spot that night.",1,yelp
125,"Host staff were, for lack of a better word, BITCHES!",0,yelp
126,Bland... Not a liking this place for a number of reasons and I don't want to waste time on bad reviewing.. I'll leave it at that...,0,yelp
127,"Phenomenal food, service and ambiance.",1,yelp
128,I wouldn't return.,0,yelp
129,"Definitely worth venturing off the strip for the pork belly, will return next time I'm in Vegas.",1,yelp
130,This place is way too overpriced for mediocre food.,0,yelp
131,Penne vodka excellent!,1,yelp
132,"They have a good selection of food including a massive meatloaf sandwich, a crispy chicken wrap, a delish tuna melt and some tasty burgers.",1,yelp
133,The management is rude.,0,yelp
134,"Delicious NYC bagels, good selections of cream cheese, real Lox with capers even.",1,yelp
135,"Great Subway, in fact it's so good when you come here every other Subway will not meet your expectations.",1,yelp
136,I had a seriously solid breakfast here.,1,yelp
137,This is one of the best bars with food in Vegas.,1,yelp
138,"He was extremely rude and really, there are so many other restaurants I would love to dine at during a weekend in Vegas.",0,yelp
139,My drink was never empty and he made some really great menu suggestions.,1,yelp
140,Don't do it!!!!,0,yelp
141,The waiter wasn't helpful or friendly and rarely checked on us.,0,yelp
142,My husband and I ate lunch here and were very disappointed with the food and service.,0,yelp
143,And the red curry had so much bamboo shoots and wasn't very tasty to me.,0,yelp
144,Nice blanket of moz over top but i feel like this was done to cover up the subpar food.,1,yelp
145,The bathrooms are clean and the place itself is well decorated.,1,yelp
146,"The menu is always changing, food quality is going down & service is extremely slow.",0,yelp
147,"The service was a little slow , considering that were served by 3 people servers so the food was coming in a slow pace.",0,yelp
148,I give it 2 thumbs down,0,yelp
149,We watched our waiter pay a lot more attention to other tables and ignore us.,0,yelp
150,My fiancé and I came in the middle of the day and we were greeted and seated right away.,1,yelp
151,This is a great restaurant at the Mandalay Bay.,1,yelp
152,We waited for forty five minutes in vain.,0,yelp
153,Crostini that came with the salad was stale.,0,yelp
154,Some highlights : Great quality nigiri here!,1,yelp
155,the staff is friendly and the joint is always clean.,1,yelp
156,this was a different cut than the piece the other day but still wonderful and tender s well as well flavored.,1,yelp
157,I ordered the Voodoo pasta and it was the first time I'd had really excellent pasta since going gluten free several years ago.,1,yelp
158,this place is good.,1,yelp
159,"Unfortunately, we must have hit the bakery on leftover day because everything we ordered was STALE.",0,yelp
160,I came back today since they relocated and still not impressed.,0,yelp
161,I was seated immediately.,1,yelp
162,"Their menu is diverse, and reasonably priced.",1,yelp
163,Avoid at all cost!,0,yelp
164,Restaurant is always full but never a wait.,1,yelp
165,DELICIOUS!!,1,yelp
166,This place is hands-down one of the best places to eat in the Phoenix metro area.,1,yelp
167,So don't go there if you are looking for good food...,0,yelp
168,I've never been treated so bad.,0,yelp
169,Bacon is hella salty.,1,yelp
170,We also ordered the spinach and avocado salad; the ingredients were sad and the dressing literally had zero taste.,0,yelp
171,"This really is how Vegas fine dining used to be, right down to the menus handed to the ladies that have no prices listed.",1,yelp
172,The waitresses are very friendly.,1,yelp
173,"Lordy, the Khao Soi is a dish that is not to be missed for curry lovers!",1,yelp
174,Everything on the menu is terrific and we were also thrilled that they made amazing accommodations for our vegetarian daughter.,1,yelp
175,"Perhaps I caught them on an off night judging by the other reviews, but I'm not inspired to go back.",0,yelp
176,The service here leaves a lot to be desired.,0,yelp
177,"The atmosphere is modern and hip, while maintaining a touch of coziness.",1,yelp
178,"Not a weekly haunt, but definitely a place to come back to every once in a while.",1,yelp
179,We literally sat there for 20 minutes with no one asking to take our order.,0,yelp
180,"The burger had absolutely no flavor - the meat itself was totally bland, the burger was overcooked and there was no charcoal flavor.",0,yelp
181,I also decided not to send it back because our waitress looked like she was on the verge of having a heart attack.,0,yelp
182,I dressed up to be treated so rudely!,0,yelp
183,It was probably dirt.,0,yelp
184,"Love this place, hits the spot when I want something healthy but not lacking in quantity or flavor.",1,yelp
185,I ordered the Lemon raspberry ice cocktail which was also incredible.,1,yelp
186,"The food sucked, which we expected but it sucked more than we could have imagined.",0,yelp
187,Interesting decor.,1,yelp
188,What I really like there is the crepe station.,1,yelp
189,"Also were served hot bread and butter, and home made potato chips with bacon bits on top....very original and very good.",1,yelp
190,you can watch them preparing the delicious food!),1,yelp
191,Both of the egg rolls were fantastic.,1,yelp
192,"When my order arrived, one of the gyros was missing.",0,yelp
193,"I had a salad with the wings, and some ice cream for dessert and left feeling quite satisfied.",1,yelp
194,I'm not really sure how Joey's was voted best hot dog in the Valley by readers of Phoenix Magazine.,0,yelp
195,The best place to go for a tasty bowl of Pho!,1,yelp
196,The live music on Fridays totally blows.,0,yelp
197,I've never been more insulted or felt disrespected.,0,yelp
198,Very friendly staff.,1,yelp
199,It is worth the drive.,1,yelp
200,"I had heard good things about this place, but it exceeding every hope I could have dreamed of.",1,yelp
201,Food was great and so was the serivce!,1,yelp
202,The warm beer didn't help.,0,yelp
203,Great brunch spot.,1,yelp
204,Service is friendly and inviting.,1,yelp
205,Very good lunch spot.,1,yelp
206,I've lived here since 1979 and this was the first (and last) time I've stepped foot into this place.,0,yelp
207,The WORST EXPERIENCE EVER.,0,yelp
208,Must have been an off night at this place.,0,yelp
209,"The sides are delish - mixed mushrooms, yukon gold puree, white corn - beateous.",1,yelp
210,"If that bug never showed up I would have given a 4 for sure, but on the other side of the wall where this bug was climbing was the kitchen.",0,yelp
211,"For about 10 minutes, we we're waiting for her salad when we realized that it wasn't coming any time soon.",0,yelp
212,My friend loved the salmon tartar.,1,yelp
213,Won't go back.,0,yelp
214,Extremely Tasty!,1,yelp
215,Waitress was good though!,1,yelp
216,Soggy and not good.,0,yelp
217,The Jamaican mojitos are delicious.,1,yelp
218,Which are small and not worth the price.,0,yelp
219,- the food is rich so order accordingly.,1,yelp
220,"The shower area is outside so you can only rinse, not take a full shower, unless you don't mind being nude for everyone to see!",0,yelp
221,The service was a bit lacking.,0,yelp
222,"Lobster Bisque, Bussell Sprouts, Risotto, Filet ALL needed salt and pepper..and of course there is none at the tables.",0,yelp
223,Hopefully this bodes for them going out of business and someone who can cook can come in.,0,yelp
224,"It was either too cold, not enough flavor or just bad.",0,yelp
225,I loved the bacon wrapped dates.,1,yelp
226,This is an unbelievable BARGAIN!,1,yelp
227,The folks at Otto always make us feel so welcome and special.,1,yelp
228,"As for the ""mains,"" also uninspired.",0,yelp
229,This is the place where I first had pho and it was amazing!!,1,yelp
230,This wonderful experience made this place a must-stop whenever we are in town again.,1,yelp
231,"If the food isn't bad enough for you, then enjoy dealing with the world's worst/annoying drunk people.",0,yelp
232,Very very fun chef.,1,yelp
233,"Ordered a double cheeseburger & got a single patty that was falling apart (picture uploaded) Yeah, still sucks.",0,yelp
234,Great place to have a couple drinks and watch any and all sporting events as the walls are covered with TV's.,1,yelp
235,"If it were possible to give them zero stars, they'd have it.",0,yelp
236,"The descriptions said ""yum yum sauce"" and another said ""eel sauce"", yet another said ""spicy mayo""...well NONE of the rolls had sauces on them.",0,yelp
237,"I'd say that would be the hardest decision... Honestly, all of M's dishes taste how they are supposed to taste (amazing).",1,yelp
238,If she had not rolled the eyes we may have stayed... Not sure if we will go back and try it again.,0,yelp
239,"Everyone is very attentive, providing excellent customer service.",1,yelp
240,Horrible - don't waste your time and money.,0,yelp
241,Now this dish was quite flavourful.,1,yelp
242,By this time our side of the restaurant was almost empty so there was no excuse.,0,yelp
243,"(It wasn't busy either) Also, the building was FREEZING cold.",0,yelp
244,"like the other reviewer said ""you couldn't pay me to eat at this place again.""",0,yelp
245,-Drinks took close to 30 minutes to come out at one point.,0,yelp
246,"Seriously flavorful delights, folks.",1,yelp
247,Much better than the other AYCE sushi place I went to in Vegas.,1,yelp
248,The lighting is just dark enough to set the mood.,1,yelp
249,Based on the sub-par service I received and no effort to show their gratitude for my business I won't be going back.,0,yelp
250,Owner's are really great people.!,1,yelp
251,There is nothing privileged about working/eating there.,0,yelp
252,The Greek dressing was very creamy and flavorful.,1,yelp
253,"Overall, I don't think that I would take my parents to this place again because they made most of the similar complaints that I silently felt too.",0,yelp
254,Now the pizza itself was good the peanut sauce was very tasty.,1,yelp
255,We had 7 at our table and the service was pretty fast.,1,yelp
256,Fantastic service here.,1,yelp
257,I as well would've given godfathers zero stars if possible.,0,yelp
258,They know how to make them here.,1,yelp
259,very tough and very short on flavor!,0,yelp
260,I hope this place sticks around.,1,yelp
261,"I have been in more than a few bars in Vegas, and do not ever recall being charged for tap water.",0,yelp
262,The restaurant atmosphere was exquisite.,1,yelp
263,"Good service, very clean, and inexpensive, to boot!",1,yelp
264,The seafood was fresh and generous in portion.,1,yelp
265,"Plus, it's only 8 bucks.",1,yelp
266,"The service was not up to par, either.",0,yelp
267,"Thus far, have only visited twice and the food was absolutely delicious each time.",1,yelp
268,Just as good as when I had it more than a year ago!,1,yelp
269,"For a self proclaimed coffee cafe, I was wildly disappointed.",0,yelp
270,The Veggitarian platter is out of this world!,1,yelp
271,You cant go wrong with any of the food here.,1,yelp
272,You can't beat that.,1,yelp
273,"Stopped by this place while in Madison for the Ironman, very friendly, kind staff.",1,yelp
274,The chefs were friendly and did a good job.,1,yelp
275,"I've had better, not only from dedicated boba tea spots, but even from Jenni Pho.",0,yelp
276,I liked the patio and the service was outstanding.,1,yelp
277,The goat taco didn't skimp on the meat and wow what FLAVOR!,1,yelp
278,I think not again,0,yelp
279,I had the mac salad and it was pretty bland so I will not be getting that again.,0,yelp
280,I went to Bachi Burger on a friend's recommendation and was not disappointed.,1,yelp
281,Service stinks here!,0,yelp
282,I waited and waited.,0,yelp
283,"This place is not quality sushi, it is not a quality restaurant.",0,yelp
284,I would definitely recommend the wings as well as the pizza.,1,yelp
285,Great Pizza and Salads!,1,yelp
286,Things that went wrong: - They burned the saganaki.,0,yelp
287,We waited an hour for what was a breakfast I could have done 100 times better at home.,0,yelp
288,This place is amazing!,1,yelp
289,"I hate to disagree with my fellow Yelpers, but my husband and I were so disappointed with this place.",0,yelp
290,Waited 2 hours & never got either of our pizzas as many other around us who came in later did!,0,yelp
291,Just don't know why they were so slow.,0,yelp
292,"The staff is great, the food is delish, and they have an incredible beer selection.",1,yelp
293,"I live in the neighborhood so I am disappointed I won't be back here, because it is a convenient location.",0,yelp
294,I didn't know pulled pork could be soooo delicious.,1,yelp
295,"You get incredibly fresh fish, prepared with care.",1,yelp
296,Before I go in to why I gave a 1 star rating please know that this was my third time eating at Bachi burger before writing a review.,0,yelp
297,I love the fact that everything on their menu is worth it.,1,yelp
298,Never again will I be dining at this place!,0,yelp
299,The food was excellent and service was very good.,1,yelp
300,Good beer & drink selection and good food selection.,1,yelp
301,Please stay away from the shrimp stir fried noodles.,0,yelp
302,The potato chip order was sad... I could probably count how many chips were in that box and it was probably around 12.,0,yelp
303,Food was really boring.,0,yelp
304,Good Service-check!,1,yelp
305,This greedy corporation will NEVER see another dime from me!,0,yelp
306,"Will never, ever go back.",0,yelp
307,"As much as I'd like to go back, I can't get passed the atrocious service and will never return.",0,yelp
308,"In the summer, you can dine in a charming outdoor patio - so very delightful.",1,yelp
309,I did not expect this to be so good!,1,yelp
310,Fantastic food!,1,yelp
311,She ordered a toasted English muffin that came out untoasted.,0,yelp
312,The food was very good.,1,yelp
313,Never going back.,0,yelp
314,"Great food for the price, which is very high quality and house made.",1,yelp
315,The bus boy on the other hand was so rude.,0,yelp
316,"By this point, my friends and I had basically figured out this place was a joke and didn't mind making it publicly and loudly known.",0,yelp
317,"Back to good BBQ, lighter fare, reasonable pricing and tell the public they are back to the old ways.",1,yelp
318,"And considering the two of us left there very full and happy for about $20, you just can't go wrong.",1,yelp
319,All the bread is made in-house!,1,yelp
320,The only downside is the service.,0,yelp
321,"Also, the fries are without a doubt the worst fries I've ever had.",0,yelp
322,Service was exceptional and food was a good as all the reviews.,1,yelp
323,"A couple of months later, I returned and had an amazing meal.",1,yelp
324,Favorite place in town for shawarrrrrrma!!!!!!,1,yelp
325,The black eyed peas and sweet potatoes... UNREAL!,1,yelp
326,You won't be disappointed.,1,yelp
327,"They could serve it with just the vinaigrette and it may make for a better overall dish, but it was still very good.",1,yelp
328,"I go to far too many places and I've never seen any restaurant that serves a 1 egg breakfast, especially for $4.00.",0,yelp
329,When my mom and I got home she immediately got sick and she only had a few bites of salad.,0,yelp
330,The servers are not pleasant to deal with and they don't always honor Pizza Hut coupons.,0,yelp
331,"Both of them were truly unbelievably good, and I am so glad we went back.",1,yelp
332,"We had fantastic service, and were pleased by the atmosphere.",1,yelp
333,Everything was gross.,0,yelp
334,I love this place.,1,yelp
335,Great service and food.,1,yelp
336,First - the bathrooms at this location were dirty- Seat covers were not replenished & just plain yucky!!!,0,yelp
337,"The burger... I got the ""Gold Standard"" a $17 burger and was kind of disappointed.",0,yelp
338,"OMG, the food was delicioso!",1,yelp
339,There is nothing authentic about this place.,0,yelp
340,the spaghetti is nothing special whatsoever.,0,yelp
341,"Of all the dishes, the salmon was the best, but all were great.",1,yelp
342,The vegetables are so fresh and the sauce feels like authentic Thai.,1,yelp
343,It's worth driving up from Tucson!,1,yelp
344,The selection was probably the worst I've seen in Vegas.....there was none.,0,yelp
345,Pretty good beer selection too.,1,yelp
346,"This place is like Chipotle, but BETTER.",1,yelp
347,"Classy/warm atmosphere, fun and fresh appetizers, succulent steaks (Baseball steak!!!!!",1,yelp
348,5 stars for the brick oven bread app!,1,yelp
349,"I have eaten here multiple times, and each time the food was delicious.",1,yelp
350,We sat another ten minutes and finally gave up and left.,0,yelp
351,He was terrible!,0,yelp
352,Everyone is treated equally special.,1,yelp
353,It shouldn't take 30 min for pancakes and eggs.,0,yelp
354,It was delicious!!!,1,yelp
355,"On the good side, the staff was genuinely pleasant and enthusiastic - a real treat.",1,yelp
356,"Sadly, Gordon Ramsey's Steak is a place we shall sharply avoid during our next trip to Vegas.",0,yelp
357,As always the evening was wonderful and the food delicious!,1,yelp
