,Review,Score,Source
1194,"I think it was Robert Ryans best film, because he portrayed someone like my father, and he was a schizophrenic in real life,(my father) although he never murdered anyone but was affected more so during the second world war which made him worse.  ",1,imdb
1195,Having to humour him just to get by and get through the day was so apt.  ,1,imdb
1196,"(My mother and brother had to do this)When I saw Robert Ryan portraying this type of man, it was a very good imitation of this type of individual, and I was impressed.  ",1,imdb
1197,Almost all of the songs in Cover Girl are old-fashioned and not very tuneful.  ,0,imdb
1198,The most annoying thing about 'Cover Girl' is the way in which Rita Hayworth is put up on a pedestal.  ,0,imdb
1199,"Unfortunately, 'Cover Girl' is an example of how Hollywood used to exploit women for financial gain.  ",0,imdb
1200,Non-linear narration thus many flashbacks and every part are articulated quite well.  ,1,imdb
1201,The good cinematography also makes her and Monica Bellucci look very beautiful.  ,1,imdb
1202,A good commentary of today's love and undoubtedly a film worth seeing.  ,1,imdb
1203,"For people who are first timers in film making, I think they did an excellent job!!  ",1,imdb
1204,"It was very popular when I was in the cinema, a good house and very good reactions and plenty of laughs.  ",1,imdb
1205,It's a feel-good film and that's how I felt when I came out of the cinema!  ,1,imdb
1206,It has northern humour and positive about the community it represents.  ,1,imdb
1207,I rather enjoyed it.  ,1,imdb
1208,I liked it.  ,1,imdb
1209,I couldn't take them seriously.  ,0,imdb
1210,It really created a unique feeling though.  ,1,imdb
1211,Vivian Schilling did an excellent job with the script.  ,1,imdb
1212,A world better than 95% of the garbage in the theatres today.  ,1,imdb
1213,Her role was played well.  ,1,imdb
1214,Not too screamy not to masculine but just right.  ,1,imdb
1215,The camera really likes her in this movie.  ,1,imdb
1216,I would have casted her in that role after ready the script.  ,1,imdb
1217,"As a European, the movie is a nice throwback to my time as a student in the 1980's and the experiences I had living abroad and interacting with other nationalities, although the circumstances were slightly different.  ",1,imdb
1218,I am a fan of his ... This movie sucked really bad.  ,0,imdb
1219,Even worse than Ticker!  ,0,imdb
1220,& That movie was bad.  ,0,imdb
1221,"Only like 3 or 4 buildings used, a couple of locations MAYBE, & poor hummh!  ",0,imdb
1222,It just blew.  ,0,imdb
1223,"This movie is excellent!Angel is beautiful and Scamp is adorable!His little yelps when hes scared,and the funniest parts are when:Scamp is caught under the curtain and when Angel and Scamp are singing 'Ive Never Had This Feeling Before'.I totally recommend this movie,its coming out on special edition on June 20.The cover has scamp on a garbage can and Angel underneath the lid.  ",1,imdb
1224,"I just cant explain this movie more than romantic,charming,hilarious,and adorable.The junkyard scenes are funny,all the junkyard dogs have something special.Too funny i laughed,kids will LOVE it.Buy it when it comes out,it has new features!  ",1,imdb
1225,Now we were chosen to be tortured with this disgusting piece of blatant American propaganda.  ,0,imdb
1226,This show is made for Americans - it is too stupid and full with hatred and clichés to be admitted elsewhere.  ,0,imdb
1227,"Almost everyone involved must be return to school, acting is utterly predictable and bad, script is pile of garbage all round.  ",0,imdb
1228,"I wish I could enter negative values, admins?  ",0,imdb
1229,"The sets are so bad, they wouldn't look out of place on a Thunderbirds episode.  ",0,imdb
1230,"The use of slow-motion needlessly repeats itself throughout the movie but is well backed up by bad acting (and bad is a kind word here), no continuity, scenes that are thrown in for no reason whatsoever, vehicles that looked like they were made from a Corn Flakes box and a directorial style that bordered on stupidity.  ",0,imdb
1231,"Oh yeah, and the storyline was pathetic too.  ",0,imdb
1232,I hate writing bad reviews about films - especially those in which I really like the star - but this film is so bad I don't believe for one second that anyone could have been proud of it.  ,0,imdb
1233,I am not a filmmaker nor am I a director but I would hide my head in the sand if I'd spent whatever amount of money and time on this movie.  ,0,imdb
1234,In short - this was a monumental waste of time and energy and I would not recommend anyone to EVER see this film.  ,0,imdb
1235,It came free with a DVD player I bought but I still turned the thing off halfway through because I was embarrassed for Howell.  ,0,imdb
1236,1/10 - and only because there is no setting for 0/10.  ,0,imdb
1237,"An interesting premise, and Billy Drago is always good as a dangerous nut-bag (side note: I'd love to see Drago, Stephen McHattie and Lance Hendrikson in a flick together; talk about raging cheekbones!).  ",1,imdb
1238,"The soundtrack wasn't terrible, either.  ",1,imdb
1239,"But the acting--even that of such professionals as Drago and Debbie Rochon--was terrible, the directing worse (perhaps contributory to the former), the dialog chimp-like, and the camera work, barely tolerable.  ",0,imdb
1240,"Still, it was the SETS that got a big ""10"" on my ""oy-vey"" scale.  ",1,imdb
1241,"Yes, I am simplifying things here for the sake of brevity, for this really is at the core of the problems with this film - it has too much going on without any real, fulfilling explanation.  ",0,imdb
1242,Both do good jobs and are quite amusing.  ,1,imdb
1243,"But the convoluted plot just didn't convince me, and much of the film was watched with a weird, questioning glance.  ",0,imdb
1244,"I let my girlfriend talk me into seeing this - bad idea, we both hated it.  ",0,imdb
1245,The last 15 minutes of movie are also not bad as well.  ,1,imdb
1246,"Bela Lugosi was totally extraneous, intoning odd lines.  ",0,imdb
1247,"The acting was decidely wooden, though no worse than a period Universal B movie.  ",0,imdb
1248,"I like Armand Assante & my cable company's summary sounded interesting, so I watched it, twice already, and probably will again.  ",1,imdb
1249,I believe the screenwriter did a good job of tying up the loose ends.  ,1,imdb
1250,My 8/10 score is mostly for the plot.  ,1,imdb
1251,"I won't say any more - I don't like spoilers, so I don't want to be one, but I believe this film is worth your time.  ",1,imdb
1252,"Wow, what a bad film.  ",0,imdb
1253,"Not frightening in the least, and barely comprehensible.  ",0,imdb
1254,"The plot doesn't hang together at all, and the acting is absolutely appalling.  ",0,imdb
1255,Not even good for camp value!  ,0,imdb
1256,"I wasn't expecting Oscar material, but this?  ",0,imdb
1257,You'd have to have the IQ of particularly stupid mollusk not to see that one coming.  ,0,imdb
1258,This film (and I use that word loosely) is an insult to the movie-going public.  ,0,imdb
1259,If only someone involved with it knew how to string together narrative!  ,0,imdb
1260,"This gets a 1 out of 10, simply because there's nothing lower.  ",0,imdb
1261,"This is one I did not have, but I watched it recently on Fox Movie Channel, and was very disappointed.  ",0,imdb
1262,"I know he was a contract player with little control over his scripts, but the acting was as bad as the script.  ",0,imdb
1263,"Victor McLaglen was even bad, and Brian DonLevy was almost unrecognizable.  ",0,imdb
1264,"Considering the relations off screen between Taylor and Stanwyck, it was surprising how little chemistry there was on screen between the two of them.  ",0,imdb
1265,But the premise of the film was so ridiculous: that the President of the U.S.  ,0,imdb
1266,The death row scenes were entirely unmoving.  ,0,imdb
1267,The only thing worse than Taylor's acting was Stanwyck's singing.  ,0,imdb
1268,"Whatever the producer was going for, he missed entirely.  ",0,imdb
1269,I was deeply impressed with the character he played.  ,1,imdb
1270,I knew when I saw the film that more great things were to come from this gifted actor.  ,1,imdb
1271,"A cheap and cheerless heist movie with poor characterisation, lots of underbite style stoic emoting (think Chow Yun Fat in A Better Tomorrow) and some cheesy clichés thrown into an abandoned factory ready for a few poorly executed flying judo rolls a la John Woo.  ",0,imdb
1272,Even the squibs look awful.  ,0,imdb
1273,At no point in the proceedings does it look remotely like America.  ,0,imdb
1274,"The plot, such as it is, is so derivative and predictable that the ending is like a mercy killing.  ",0,imdb
1275,The awful dialogue and hopeless overacting by everyone who gets shot top off a real waste of space and time.  ,0,imdb
1276,"I was very uneasy with how bad this movie was, but not scared at all.  ",0,imdb
1277,The dialogue is composed of things that make little sense.  ,0,imdb
1278,"About 30 minutes of footage is wasted to show mediocre elderly actors awkwardly babbling overwrought pseudo-Satanic gibberish corny enough to make a teen Goth blush, almost always in Olde English, and sometimes in Latin that may or may not be made up words.  ",0,imdb
1279,The directing is sloppy at best.  ,0,imdb
1280,"Hackneyed writing, certainly, but made even worse by the bad directing.  ",0,imdb
1281,"Of course, the acting is blah.  ",0,imdb
1282,The acting by the whole cast could be put on a scale and balanced perfectly between overacting and underacting.  ,0,imdb
1283,"And, FINALLY, after all that, we get to an ending that would've been great had it been handled by competent people and not Jerry Falwell.  ",0,imdb
1284,"I loved this movie it was a great portrayal of a family who had it's share of ups and down, but in the end they knew that special love they had for each other.  ",1,imdb
1285,"I have seen many movies starring Jaclyn Smith, but my god this was one of her best, though it came out 12 years ago.  ",1,imdb
1286,"This movie contained an all-star cast, and what I loved the most was that it opened my eyes to see other actors who I haven't seen before.  ",1,imdb
1287,"This movie was kind of long in length, but I enjoyed every minute of it.  ",1,imdb
1288,Overall I rate this movie a 10 out of a 1-10 scale.  ,1,imdb
1289,"Lifetime does not air it enough, so if anyone knows what store sells it let me know because this is a must-have.  ",1,imdb
1290,"I particularly remember my senses being assaulted by strident cords of music that would blare out with very little warning, and even less meaning.  ",0,imdb
1291,It is just the sort of pap that is screened in the afternoon to punish the unemployed for not having jobs.  ,0,imdb
1292,"Totally different, with loads of understatement and black comedy, this is a film few get to see, but those who do will remember it.  ",1,imdb
1293,"This movie creates its own universe, and is fascinating in every way.  ",1,imdb
1294,But this movie really got to me.  ,1,imdb
1295,See it.  ,1,imdb
1296,"I really hope the team behind this movie makes more movies, and that they will continue to do so in their own, some kinda weird style.  ",1,imdb
1297,"And I forgot: The Casting here i superb, with Trond Fausa Aurvåg being perfect in the role as the Bothersome Man, who doesn't understand where he is, what he is doing and why.  ",1,imdb
1298,This movie is a good and humorous comment on life in 2006.  ,1,imdb
1299,"I found this move beautiful, enjoyable, and uplifting.  ",1,imdb
1300,"Initially the local sites in the film, which was filmed here in Buffalo, intrigued me.  ",1,imdb
1301,Later I found myself lost in the power of the film.  ,1,imdb
1302,The entire audience applauded at the conclusion of the film.  ,1,imdb
1303,"I left the theater with a lilt in my step, joy in my heart and hope for the human race.  ",1,imdb
1304,Duris has a wholesome appearance and gives a fine performance.  ,1,imdb
1305,The rest of the cast also play well.  ,1,imdb
1306,Cinematography noteworthy including fine views of Barcelona and its famed Gaudi towers.  ,1,imdb
1307,About ten minutes into this film I started having second thoughts.  ,0,imdb
1308,About half way through this film I started to dislike it.  ,0,imdb
1309,"By the time the film ended, I not only disliked it, I despised it.  ",0,imdb
1310,What this film lacks is a convincing script.  ,0,imdb
1311,The script looks as if only a rough draft was written and shooting began before a finished script was completed.  ,0,imdb
1312,"Things happen, characters personalities change, plot twists occur for no real reason other than that script calls for it.  ",0,imdb
1313,The cast is good.  ,1,imdb
1314,"For that, it's worth checking out.  ",1,imdb
1315,This is probably the most irritating show I have ever seen in my entire life.  ,0,imdb
1316,It is indescribably the most annoying and idiotic show I have ever seen.  ,0,imdb
1317,Everything about it is just bad.  ,0,imdb
1318,"I could not understand, what kind of idiot would produce this mess in the first place not to mention several season.  ",0,imdb
1319,"The script is bad, very bad  it contains both cheesiness and unethical joke that you normally see in rated R or NC-17 movie.  ",0,imdb
1320,"The casting is also horrible, cause all you see is a really really BAD Actors, period.  ",0,imdb
1321,Final Word: This Show is a real torture!!  ,0,imdb
1322,It is zillion times away from reality.  ,0,imdb
1323,Watching washing machine twirling around wouldn't hurt your eyes as much as this show.  ,0,imdb
1324,Rating: 0/10 (Grade: Z) Note: The Show Is So Bad That Even Mother Of The Cast Pull Her Daughter Out Of The Show.  ,0,imdb
1325,20th Century Fox's ROAD HOUSE 1948) is not only quite a silly noir but is an implausible unmitigated bore of a movie.  ,0,imdb
1326,"Full of unconvincing cardboard characters it is blandly written by Edward Chodorov, who also produced, and is surprisingly directed by Jean Negulesco from whom one would expect a great deal more.  ",0,imdb
1327,From here on the Widmark character turns unintentionally comical!  ,0,imdb
1328,His losing his marbles so early in the proceedings is totally implausible and unconvincing.  ,0,imdb
1329,And if that isn't enough of a mess of a movie for you - the picture is also marred with a constant use of studio sets and indoor exteriors.  ,0,imdb
1330,Whatever prompted such a documentary is beyond me!  ,0,imdb
1331,(very serious spoilers) this movie was a huge disappointment.  ,0,imdb
1332,there are so many problems i dont know where to start.  ,0,imdb
1333,the cast was great.  ,1,imdb
1334,"steve martin delivers a really funny performance of a middle-aged, upper class, uptight white guy.  ",1,imdb
1335,add betty white and jean smart and you have a great cast - everyone played their parts really well.  ,1,imdb
1336,but the movie makes a lot of serious mistakes.  ,0,imdb
1337,"first of all, there are enough racial stereotypes and racial jokes to offend everyone.  ",0,imdb
1338,the movie is littered with overt racial slurs towards the black cast members and in return the whites are depicted as morons and boobs.  ,0,imdb
1339,"putting the race card aside, lets look at the major flaw in the film: they destroy latifa's character.  ",0,imdb
1340,there is no real plot.  ,0,imdb
1341,i wouldnt see this movie again for free.  ,0,imdb
1342,STEAMBOAT WILLIE is an amazingly important film to our cinema history.  ,1,imdb
1343,This second appearance of Mickey Mouse (following the silent PLANE CRAZY earlier that year) is probably his most famous film--mostly because it was so ground-breaking.  ,1,imdb
1344,"While you don't yet hear Mickey speak, there are tons of sound effects and music throughout the film--something we take for granted now but which was a huge crowd pleaser in 1928.  ",1,imdb
1345,"However, after seeing the short again after about 25 years, I was amazed at how timeless the film actually is.  ",1,imdb
1346,"It's just adorable seeing Mickey playing ""Turkey in the Straw"" in a highly imaginative (if occasionally cruel) way.  ",1,imdb
1347,Clever and a real crowd-pleaser--this film still ranks among Mickey's best films even after 80 wonderful years.  ,1,imdb
1348,"The bipolarity of the ruthless thug (one minute a ruthless killer, the next minute a Luv's diaper commercial) is completely unconvincing.  ",0,imdb
1349,"I'm terribly disappointed that this film would receive so many awards and accolades, especially when there are far more deserving works of film out there.  ",0,imdb
1350,The original Body and Soul (1947) is a masterpiece.  ,1,imdb
1351,"John Garfield, Ann revere, Lilli Plmer, William Conrad, Canada Lee...and filmed by one of the greatest cinematographers to ever grace the screen..James Wong Howe.  ",1,imdb
1352,I don't think there are any redeeming qualities in this remake.  ,0,imdb
1353,This may be the only bad film he ever made.  ,0,imdb
1354,So bad...well...it's just bad.  ,0,imdb
1355,"This movie is a solid example of a bad plot and a very, very bad idea all the way.  ",0,imdb
1356,It's a shame to see good actors like Thomerson and James make a living in a mess like this.  ,0,imdb
1357,I thought it was bad.  ,0,imdb
1358,"Both films are terrible, but to the credit of the 1986 version, it was watchable.  ",0,imdb
1359,"Let's start with all the problemsthe acting, especially from the lead professor, was very, very bad.  ",0,imdb
1360,The script is a big flawed mess.  ,0,imdb
1361,The best example of how dumb the writing is when it's established that you can turn the zombie-students back into humans by removing a necklace containing a piece of the meteorite.  ,0,imdb
1362,"Director Paul Matthews, who also wrote/directed the weak 1995 monster movie ""Grim"", clearly doesn't know how to pace his films.  ",0,imdb
1363,The movie is terribly boring in places.  ,0,imdb
1364,The lighting is awful.  ,0,imdb
1365,The film looks cheap and bland.  ,0,imdb
1366,One of the most disappointing aspects is the lack of notable gore.  ,0,imdb
1367,"This convention never worked well in the past, and certainly doesn't work here.  ",0,imdb
1368,The visual effects were AWFUL.  ,0,imdb
1369,The CG opening sequence in space looked like it could have been created on Microsoft Slideshow for God's sake!  ,0,imdb
1370,"The ""explosion"" of the Gas tanks at the end was just as awful.  ",0,imdb
1371,"Okay, I like to consider myself a fair critic, so I'll give credit where credit's due--the creature effects were actually pretty cool.  ",1,imdb
1372,"Gotta love those close-ups of slimy, drooling teeth!  ",1,imdb
1373,"To sum the film up, ""Breeders"" is a terrible, cheaply made horror movie that should be avoided like the Ebola virus.  ",0,imdb
1374,Not recommended.  ,0,imdb
1375,"He is almost unbearable to watch on screen, he has little to no charisma, and terrible comedic timing.  ",0,imdb
1376,"Aside from it's terrible lead, this film has loads of other debits.  ",0,imdb
1377,"I understand that it's supposed to be a cheap popcorn comedy, but that doesn't mean that it has to completely insult our intelligence, and have writing so incredibly hackneyed that it borders on offensive.  ",0,imdb
1378,"Lewis Black's considerable talent is wasted here too, as he is at his most incendiary when he is unrestrained, which the PG-13 rating certainly won't allow.  ",0,imdb
1379,The film's sole bright spot was Jonah Hill (who will look almost unrecognizable to fans of the recent Superbad due to the amount of weight he lost in the interim).  ,1,imdb
1380,"With the originality and freshness of the first movie now spent, this remake had little else to offer.  ",0,imdb
1381,The budget was evidently very limited.  ,0,imdb
1382,"This was reflected not only in the cast, but also in the below-par script, which borrowed much from the earlier classic.  ",0,imdb
1383,"However, here there was no decent acting, action or location work to balance things up.  ",0,imdb
1384,Filmiing was less expansive.  ,0,imdb
1385,It failed to convey the broad sweep of landscapes that were a great part of the original.  ,0,imdb
1386,Generally; it just lacked imagination.  ,0,imdb
1387,Not recommended.  ,0,imdb
1388,Is it possible for a movie to get any worse than this?  ,0,imdb
1389,There is no plot here to keep you going in the first place.  ,0,imdb
1390,"Even when the women finally show up, there is no sign of improvement; the most expected things happen and by the time the film is over, you might be far asleep.  ",0,imdb
1391,"Beware: this is not a trashy cult movie, this is trash -period!  ",0,imdb
1392,I can't believe there's even a sequel to this!  ,0,imdb
1393,Which is precisely why I am giving it such a bad review!  ,0,imdb
1394,"Being a 90's child, I truly enjoyed this show and I can proudly say that I enjoyed it big time and even more than the classical WB cartoons.  ",1,imdb
1395,"But ""Tiny Toons"" kept the 90's vibe and delivered one of the most popular, funny, and underrated cartoons ever created.  ",1,imdb
1396,The memories are murky but I can only say that I enjoyed every single episode and product related to the show.  ,1,imdb
1397,"Easily, none other cartoon made me laugh in a tender way (before getting into dark sitcoms oriented for teenagers).  ",1,imdb
1398,The characters were all funny and had the peculiarity of not having a true lead character.  ,1,imdb
1399,Every single character was hilarious and deserved to be called a lead.  ,1,imdb
1400,"Every element of this story was so over the top, excessively phony and contrived that it was painful to sit through.  ",0,imdb
1401,"Her lines seem to have been WRITTEN by a fifteen year old, though they are trying oh so, so hard to sound like how a fifteen year old would really, um, you know, well... talk.  ",0,imdb
1402,Perabo has a nice energy level and is obviously very comfortable in front of a camera.  ,1,imdb
1403,There is simply no excuse for something this poorly done.  ,0,imdb
1404,I saw this movie and I thought this is a stupid movie.  ,0,imdb
1405,What is even more stupid is that who had thought an idea that there should be a volcano in Los Angeles?  ,0,imdb
1406,"To be honest with you, this is unbelievable nonsense and very foolish.  ",0,imdb
1407,"In conclusion, I will not bother with this movie because a volcano in Los Angeles is nothing but nonsense.  ",0,imdb
1408,The story line is just awful!  ,0,imdb
1409,It's just painful!  ,0,imdb
1410,And the accents are absolutely abysmal!  ,0,imdb
1411,There's also enough hypocrisy in this film to make me vomit.  ,0,imdb
1412,Don't waste your time watching this rubbish non-researched film.  ,0,imdb
1413,I believe that Pitch Black was done well.  ,1,imdb
1414,"The characters are interesting and you want to find out more about them the longer the movie goes on, and I think people will be surprised by who does and doesn't make it.  ",1,imdb
1415,Go watch it!  ,1,imdb
1416,Omit watching this.  ,0,imdb
1417,VERY funny!  ,1,imdb
1418,My rating: just 3 out of 10.  ,0,imdb
1419,The characters are interesting and you really care for them.  ,1,imdb
1420,"An instant classic, with a great soundtrack and a catchy song during the ending credits.  ",1,imdb
1421,Don't miss it.  ,1,imdb
1422,"This is a masterful piece of film-making, with many themes simmering and occasionally boiling over in this warts and all study of the poet's bohemian, self-indulgent wartime years that span the aerial bombardments of London and the outward tranquillity of a Welsh coastal retreat - the borderlines between friendship, lust and love, dedication to art and experience versus practical concerns, jealousy, rivalry, cowardice and egotism versus heroism and self-sacrifice and more.  ",1,imdb
1423,"A mature, subtle script that suggests and occasionally brings into dramatic focus the underlying tensions is well served by perfect performances (apart from the odd inappropriate smiling that Keira Knightley is prone to, though perhaps under direction this time as the other characters themselves often mention it).  ",1,imdb
1424,"But above all the exquisite visual composition of each moment, with inventive and elegant use of close-up, camera angle and lighting, including pointillistic faux home movie footage, is a wonder and joy to behold.  ",1,imdb
1425,"It's as continuously beautiful to look at as a Bertolucci, but the relationships here are more convincing and the narrative more engaging than some of that master's work.  ",1,imdb
1426,The basic premise is wasted since it is sidelined by the inexplicable focus on the documentary crew.  ,0,imdb
1427,"Regardless, the film fails on most levels.  ",0,imdb
1428,Avoid at all costs.  ,0,imdb
1429,"I saw this film over Christmas, and what a great film it was!  ",1,imdb
1430,I thought Errol Flynn was brilliant as Custer and has since become my favourite actor!  ,1,imdb
1431,His acting alongside Olivia De Havilland was brilliant and the ending was fantastic!  ,1,imdb
1432,"I had always known that Errol Flynn was a brilliant actor as he was my dads favourite actor, and I grew up watching his films as a child.  ",1,imdb
1433,But it wasn't until I watched this film that I realised how great he actually was.  ,1,imdb
1434,I'll give this film 10 out of 10!  ,1,imdb
1435,"I know that Jim O'Connor was very energetic and that nobody could be as much as him, but George was well dull.  ",0,imdb
1436,"He really didn't seem to want to be hosting; his voice-overs were monotonous, didn't get involved with the guests.  ",0,imdb
1437,"Lovely little thriller from Hitchcock, with lots of nice shenanigans surrounding a murdered spy, a kidnapped child, a nasty church, a foreign plot and some random taxidermists.  ",1,imdb
1438,"Jimmy Stewart is as ever a great hero for Hitchcock, the story rips along to its cool climax at an embassy function, but it lacks the brooding menace of Hitchcock's black and white, low-budget original.  ",1,imdb
